{
  "schema_version": "wtp.report_input/0.1",
  "synthetic": true,
  "run": {
    "run_id": "demo-run-001",
    "site_url": "https://qa.example.invalid",
    "started_at": "2026-10-12T14:00:00+09:00",
    "ended_at": "2026-10-12T14:03:00+09:00",
    "termination_reason": "시간 한도 도달 (프로토타입용 합성 기록)"
  },
  "environment": {"browser": "Chrome / 버전 미확인", "viewport": "PC 1440 × 900 (합성 조건). 모바일 검사는 미완료."},
  "checks": [
    {"check_id": "check-help", "page_url": "https://qa.example.invalid/help", "item": "더 보기 버튼의 도움말 표시", "status": "completed", "reason": "합성 행동·관찰 기록 있음. 최종 판정은 미구현.", "action_ids": ["action-help"]},
    {"check_id": "check-route", "page_url": "https://qa.example.invalid", "item": "도움말 페이지 이동", "status": "completed", "reason": "합성 기록에서 지정 경로에 도착", "action_ids": ["action-route"]},
    {"check_id": "check-mobile", "page_url": "https://qa.example.invalid/help", "item": "모바일 메뉴 접근", "status": "incomplete", "reason": "시간 한도로 화면 관찰 미수집", "action_ids": []}
  ],
  "actions": [
    {"action_id": "action-route", "description": "홈 화면에서 도움말 링크 선택", "execution": "executed", "inputs": []},
    {"action_id": "action-help", "description": "도움말 화면의 더 보기 버튼 선택", "execution": "executed", "inputs": []},
    {"action_id": "action-search", "description": "도움말 화면의 검색 입력란에 검색어 입력", "execution": "executed", "inputs": [{"name": "search", "value": "배송 안내", "sensitive": false}]}
  ],
  "findings": [{
    "finding_id": "finding-help",
    "page_url": "https://qa.example.invalid/help",
    "title": "더 보기 이후 도움말 영역 표시 여부 확인 필요",
    "category": "functional",
    "status": "candidate",
    "reason": "합성 예시의 문제 후보. 최종 버그 판정 기능과 연결되지 않았습니다.",
    "expected": {"statement": "더 보기 버튼을 누르면 도움말 영역을 표시한다.", "source": "합성 예시의 사용자 제공 요구사항", "source_ref": "demo-requirement-help"},
    "actual": "합성 관찰 기록에는 도움말 영역이 보이지 않는 것으로 기록됨. 실제 사이트에서 관찰한 사실이 아닙니다.",
    "preconditions": "도움말 페이지 최초 방문, 로그인 불필요 (합성 조건)",
    "action_ids": ["action-search", "action-help"],
    "reproduction": {"status": "not_run", "reason": "추가 재현 기능 미연동", "action_ids": []}
  }],
  "evidence": [
    {"evidence_id": "evidence-demo-image", "kind": "screenshot", "path": "evidence/demo-layout.png", "finding_ids": ["finding-help"], "action_ids": ["action-help"], "phase": "initial", "share_safe": true, "reason": "레이아웃 검수용 합성 이미지. 실제 사이트 스크린샷이 아닙니다."},
    {"evidence_id": "evidence-demo-log", "kind": "log", "path": "evidence/demo.txt", "finding_ids": ["finding-help"], "action_ids": ["action-help"], "phase": "initial", "share_safe": true, "reason": "합성 로그"},
    {"evidence_id": "evidence-replay", "kind": "screenshot", "path": null, "finding_ids": ["finding-help"], "action_ids": [], "phase": "reproduction", "share_safe": false, "reason": "추가 재현 미실행으로 파일 없음"}
  ],
  "unknown_reasons": {"/evidence/2/path": "추가 재현을 실행하지 않아 증거 파일이 생성되지 않음"}
}
